{
  "nombre": "Roque",
  "empresa": "Evento Villanueva Throwdown",
  "cargo": "CEO",
  "texto": "54 medallas personalizadas para las 9 categorías del Throwdown, con grabado láser en el reverso. Un proceso ágil que nos permitió tener un producto de calidad profesional para el Evento, superando lo que esperábamos de una pieza impresa en 3D.",
  "stars": 5
}
