{
  "nombre": "Carlos López",
  "empresa": "Bufete López & Asociados",
  "cargo": "Socio fundador",
  "texto": "Los sets de escritorio fueron el regalo perfecto para nuestros clientes. Calidad increíble y una personalización real, no la típica serigrafía de empresa. Repetiremos seguro.",
  "stars": 5
}
