{
  "nombre": "María García",
  "empresa": "TechConf Salamanca",
  "cargo": "Directora de Marketing",
  "texto": "Encargamos 200 llaveros para nuestra conferencia y quedaron espectaculares. Proceso muy ágil, comunicación directa y entrega antes del plazo previsto. Los asistentes los guardaron todos.",
  "stars": 5
}
